56,https://online-learning.harvard.edu/course/19th-century-opera-meyerbeer-wagner-verdi?delta=1,"19th-Century Opera: Meyerbeer, Wagner, & Verdi",ART & DESIGN,Introductory,The technologies behind 1830s French opera performances The relationships among major players in the premiere of Les Huguenots How Romanticism differed from the optimism of the Enlightenment The different singing styles in French Grand Opera Innovations in staging between the three periods of opera How Wagner represented characters and situations with musical themes,"Travel through central Europe in the 1800s to experience the premieres of Meyerbeer’s Les Huguenots, Wagner’s Das Rheingold, and Verdi’s Otello. A complement to our course on 18th-century opera, you’ll be introduced to opera through an in-depth study of these canonical works. You’ll learn about the musical details of each opera and the cultural influence of the works by understanding the circumstances of its composition, premiere performance, and its legacy and significance today. First, step inside the Paris Opéra in 1836 for the premiere performance of Giacomo Meyerbeer’s grand opera Les Huguenots. Go behind the scenes to discover the people and technology that made this type of opera such a thrilling combination of music and spectacle, important in its time but little-known today. You’ll learn about the characteristics of opera from this period, those involved in producing the premiere, and the social context surrounding Les Huguenots. Then, journey to Bayreuth in 1876 for the first production of Richard Wagner’s Das Rheingold, the opening opera of his four-part saga Der Ring des Nibelungen. Discover how Wagner used musical themes to tell this mythical story and learn about the advancements in stage technology that brought this work to life. Finally, travel to Milan in 1887 for the premiere of Giuseppe Verdi’s second-to-last opera, Otello. Learn how Verdi’s musical approach to this Shakespearean tragedy, his first opera after a fifteen-year hiatus, was influenced by the operatic innovations of his contemporary, Richard Wagner. Enroll now to get to know the music of these three amazing operas, the 19th-century cultural context in which they were performed, and how they remain relevant in today’s complex musical landscape.",century opera meyerbeer wagner verdi,art design,introductory,travel central europe experience premieres meyerbeer huguenots wagner rheingold verdi otello complement course century opera introduced opera depth study canonical works learn musical details opera cultural influence works understanding circumstances composition premiere performance legacy significance today first step inside paris opéra premiere performance giacomo meyerbeer grand opera huguenots go behind scenes discover people technology made type opera thrilling combination music spectacle important time little known today learn characteristics opera period involved producing premiere social context surrounding huguenots journey bayreuth first production richard wagner rheingold opening opera four part saga ring nibelungen discover wagner used musical themes tell mythical story learn advancements stage technology brought work life finally travel milan premiere giuseppe verdi second last opera otello learn verdi musical approach shakespearean tragedy first opera fifteen year hiatus influenced operatic innovations contemporary richard wagner enroll get know music three amazing operas century cultural context performed remain relevant today complex musical landscape
57,https://online-learning.harvard.edu/course/bioethics-law-medicine-and-ethics-reproductive-technologies-and-genetics?delta=1,"Bioethics: The Law, Medicine, and Ethics of Reproductive Technologies and Genetics",HUMANITIES,Introductory,"How the reproductive technology industry works, and issues raised related to buying and selling human reproductive materials The law and ethics of surrogacy Civil lawsuits when things go wrong with reproductive technology: wrongful birth and wrongful life lawsuits The law and ethics of sperm donation and the legal status of sperm donors, and of mixing human and animal genetic material Ethical and legal issues raised by human enhancement The ownership of human tissue and its underlying genetic information","Bioethics provides an overview of the legal, medical, and ethical questions around reproduction and human genetics and how to apply legal reasoning to these questions. This law course includes interviews with individuals who have used surrogacy and sperm donation, with medical professionals who are experts in current reproductive technologies like In Vitro Fertilization and Preimplantation Genetic Diagnosis, and bioethicists and journalists who study the ownership and use of genetic information within human tissue. Additional Harvard colleagues will also share with you their thoughts on topics such as disability law as it relates to reproductive technology. While the law and ethics surrounding these technologies are a central component to this course, we also show you examples of the deeply personal and human side of these issues. Throughout the course, and with the help of law students, we will discuss leading legal cases in this field, which will illuminate the types of questions the law has struggled with – stretching and evolving over time. From the famous Baby M surrogacy case, to cases on the paternity of sperm donors, to a case related to the ownership of human tissue turned into a commercial product, and others. We will show you the ethical, legal, and rhetorical underpinnings, which have served as the basis for various court decisions over the past 20 or 30 years. We will also explore potential future technologies and their implications for society: genetic enhancements to increase our intelligence, let us live a hundred years longer, or make us immune to diseases – and the possibility of creating animal-human hybrids, for example a mouse with a humanized brain. The content within this course is intended to be instructive, and show how legal reasoning has been applied, or could be applied, to questions related to parenthood, reproduction, and other issues surrounding human genetic material. The material organized within this course should be considered an authoritative overview, but is not intended to serve as medical or legal advice. This course is designed for a diverse audience including, but not limited to, law students, prospective law students, medical professionals, as well as members of the general public interested in questions and topics related to surrogacy, parenthood, genetic and reproductive technology, ownership of genetic material, and more. You do not need any background in law, medicine, philosophy, or really any subject to enjoy this course. This course is meant to be an introduction for anyone interested in these topics.",bioethics law medicine ethics reproductive technologies genetics,humanities,introductory,bioethics provides overview legal medical ethical questions around reproduction human genetics apply legal reasoning questions law course includes interviews individuals used surrogacy sperm donation medical professionals experts current reproductive technologies like vitro fertilization preimplantation genetic diagnosis bioethicists journalists study ownership use genetic information within human tissue additional harvard colleagues share thoughts topics disability law relates reproductive technology law ethics surrounding technologies central component course show examples deeply personal human side issues throughout course help law students discuss leading legal cases field illuminate types questions law struggled stretching evolving time famous baby surrogacy case cases paternity sperm donors case related ownership human tissue turned commercial product others show ethical legal rhetorical underpinnings served basis various court decisions past years explore potential future technologies implications society genetic enhancements increase intelligence let us live hundred years longer make us immune diseases possibility creating animal human hybrids example mouse humanized brain content within course intended instructive show legal reasoning applied could applied questions related parenthood reproduction issues surrounding human genetic material material organized within course considered authoritative overview intended serve medical legal advice course designed diverse audience including limited law students prospective law students medical professionals well members general public interested questions topics related surrogacy parenthood genetic reproductive technology ownership genetic material need background law medicine philosophy really subject enjoy course course meant introduction anyone interested topics
58,https://online-learning.harvard.edu/course/rhetoric-art-persuasive-writing-and-public-speaking?delta=1,Rhetoric: The Art of Persuasive Writing and Public Speaking,HUMANITIES,Introductory,When and how to employ a variety of rhetorical devices in writing and speaking How to differentiate between argument and rhetorical technique How to write a persuasive opinion editorial and short speech How to evaluate the strength of an argument How to identify logical fallacies in arguments,"We are living in a contentious time in history. Fundamental disagreements on critical political issues make it essential to learn how to make an argument and analyze the arguments of others. This ability will help you engage in civil discourse and make effective changes in society. Even outside the political sphere, conveying a convincing message can benefit you throughout your personal, public, and professional lives. This course is an introduction to the theory and practice of rhetoric, the art of persuasive writing and speech. In it, you will learn to construct and defend compelling arguments, an essential skill in many settings. We will be using selected addresses from prominent twentieth-century Americans — including Martin Luther King Jr., John F. Kennedy, Margaret Chase Smith, Ronald Reagan, and more — to explore and analyze rhetorical structure and style. Through this analysis, you will learn how speakers and writers persuade an audience to adopt their point of view. Built around Harvard Professor James Engell’s on-campus course, “Elements of Rhetoric,” this course will help you analyze and apply rhetorical structure and style, appreciate the relevance of persuasive communication in your own life, and understand how to persuade and recognize when someone is trying to persuade you. You will be inspired to share your viewpoint and discover the most powerful ways to convince others to champion your cause. Join us to find your voice!",rhetoric art persuasive writing public speaking,humanities,introductory,living contentious time history fundamental disagreements critical political issues make essential learn make argument analyze arguments others ability help engage civil discourse make effective changes society even outside political sphere conveying convincing message benefit throughout personal public professional lives course introduction theory practice rhetoric art persuasive writing speech learn construct defend compelling arguments essential skill many settings using selected addresses prominent twentieth century americans including martin luther king jr john f kennedy margaret chase smith ronald reagan explore analyze rhetorical structure style analysis learn speakers writers persuade audience adopt point view built around harvard professor james engell campus course elements rhetoric course help analyze apply rhetorical structure style appreciate relevance persuasive communication life understand persuade recognize someone trying persuade inspired share viewpoint discover powerful ways convince others champion cause join us find voice
59,https://online-learning.harvard.edu/course/women-making-history-ten-objects-many-stories?delta=1,"Women Making History: Ten Objects, Many Stories",HUMANITIES,Introductory,"The many ways ordinary people have created change The centrality of women in American history How history is complex, nonlinear, and in constant conversation with the present How objects can embody stories of change How our understanding of history is shaped by which stories are told","As we approach the centennial of the passage of women’s suffrage in 1920, there has been a recent burst of activism among American women. Women are running for political office in record numbers. Women are organizing and taking to the streets to demand change. Women are grappling with inclusion and intersectionality. While some of this activity may have been a response to the 2016 presidential elections, its roots lie deep in 20th-century history — a history richly preserved in Harvard’s Schlesinger Library building on the library’s 75th Anniversary Exhibit. This course exemplifies the importance of archives in the making of history. Professors Laurel Ulrich and Jane Kamensky, along with colleagues from across Harvard University and beyond, show how women in the 20th-century United States pushed boundaries, fought for new rights, and challenged contemporary notions of what women could and should do. Through the exploration of ten iconic objects from the Schlesinger collection, they demonstrate how women created change by embracing education, adopting new technologies, and creating innovative works of art; pushing against discrimination and stepping into new roles in public and in private.",women making history ten objects many stories,humanities,introductory,approach centennial passage women suffrage recent burst activism among american women women running political office record numbers women organizing taking streets demand change women grappling inclusion intersectionality activity may response presidential elections roots lie deep century history history richly preserved harvard schlesinger library building library anniversary exhibit course exemplifies importance archives making history professors laurel ulrich jane kamensky along colleagues across harvard university beyond show women century united states pushed boundaries fought new rights challenged contemporary notions women could exploration ten iconic objects schlesinger collection demonstrate women created change embracing education adopting new technologies creating innovative works art pushing discrimination stepping new roles public private
60,https://online-learning.harvard.edu/course/first-nights-handel%E2%80%99s-messiah-and-baroque-oratorio?delta=0,Handel's Messiah and Baroque Oratorio,ART & DESIGN,Introductory,Get to know some wonderful music Identify genres and subgenres of 18th-century opera and oratorio Understand text-music relationships in the Baroque period Distinguish basic aspects of musical texture and musical form Appreciate cultural context and performance circumstances of Handel’s Messiah,"While Italian opera set the standard in the Baroque era, German composer George Frederic Handel quickly gained popularity for his oratorios, which put operatic techniques to work in the service of sacred music. Handel’s Messiah premiered in Dublin on April 13, 1742, and remains popular to this day. Harvard’s Thomas Forrest Kelly (Morton B. Knafel Professor of Music) guides learners through Messiah’s musical highlights while detailing Handel’s composition process, the preparations and rehearsals, and the premiere performance. Learners in this module of First Nights need not have any prior musical experience. In this unit, you will learn the basics of musical form and analysis, the genres and styles used in Messiah, the circumstances of its first performance, and its subsequent history.",handel messiah baroque oratorio,art design,introductory,italian opera set standard baroque german composer george frederic handel quickly gained popularity oratorios put operatic techniques work service sacred music handel messiah premiered dublin april remains popular day harvard thomas forrest kelly morton b knafel professor music guides learners messiah musical highlights detailing handel composition process preparations rehearsals premiere performance learners module first nights need prior musical experience unit learn basics musical form analysis genres styles used messiah circumstances first performance subsequent history
61,https://online-learning.harvard.edu/course/first-nights-beethoven%E2%80%99s-9th-symphony-and-19th-century-orchestra?delta=0,Beethoven's 9th Symphony and the 19th Century Orchestra,ART & DESIGN,Introductory,Identify and describe the forms of 18th- and 19th- century orchestral music Understand the instruments and voices of the orchestra and choir Appreciate cultural context and performance circumstances of Beethoven’s 9th Symphony,"Ludwig van Beethoven’s 9th Symphony premiered in Vienna in 1824 and continues to be one of the most popular symphonies in the repertoire. The monumental symphony’s size and complexity stretch traditional instrumental forms to the breaking point, and its famous choral finale changed our view of orchestral music forever. Harvard’s Thomas Forrest Kelly (Morton B. Knafel Professor of Music) guides learners through all four movements of Beethoven’s 9th Symphony, highlighting aspects of symphonic form, describing Beethoven’s composition process, the rehearsals and premiere performance, and the work’s continued relevance today. You will learn the basics of musical form and analysis, the genres and styles used and the circumstances of this symphony’s first performance and subsequent history. Learners in this course need not have any prior musical experience.",beethoven symphony century orchestra,art design,introductory,ludwig beethoven symphony premiered vienna continues popular symphonies repertoire monumental symphony size complexity stretch traditional instrumental forms breaking point famous choral finale changed view orchestral music forever harvard thomas forrest kelly morton b knafel professor music guides learners four movements beethoven symphony highlighting aspects symphonic form describing beethoven composition process rehearsals premiere performance work continued relevance today learn basics musical form analysis genres styles used circumstances symphony first performance subsequent history learners course need prior musical experience
62,https://online-learning.harvard.edu/course/first-nights-berlioz%E2%80%99s-symphonie-fantastique-and-program-music-19th-century?delta=1,First Nights: Berlioz’s Symphonie Fantastique and Program Music in the 19th Century,ART & DESIGN,Introductory,"Stylistic features of Romantic music, including program music Technical details of composition and orchestration in the 19th century Appreciate cultural context and performance circumstances of Berlioz’s Symphonie Fantastique","Six years after the premiere of Beethoven’s monumental Ninth Symphony, composer Hector Berlioz sought to make use of the symphonic genre, but on his terms. Indeed, he wrote not only a five-movement symphony but also a narrative program to accompany and explain the symphony. This music course introduces students to the music and programmatic elements of Berlioz’s Symphonie Fantastique, illuminating a new direction for nineteenth-century music. The course’s grand finale is a live performance of the entire symphony by the Harvard Radcliffe Orchestra. Harvard’s Thomas Forrest Kelly (Morton B. Knafel Professor of Music) guides learners through Berlioz’s Symphony Fantastique, highlighting Berlioz’s compositional process, his innovative orchestration, and the reception of his controversial piece of narrative instrumental music.",first nights berlioz symphonie fantastique program music century,art design,introductory,six years premiere beethoven monumental ninth symphony composer hector berlioz sought make use symphonic genre terms indeed wrote five movement symphony narrative program accompany explain symphony music course introduces students music programmatic elements berlioz symphonie fantastique illuminating new direction nineteenth century music course grand finale live performance entire symphony harvard radcliffe orchestra harvard thomas forrest kelly morton b knafel professor music guides learners berlioz symphony fantastique highlighting berlioz compositional process innovative orchestration reception controversial piece narrative instrumental music
63,https://online-learning.harvard.edu/course/first-nights-igor-stravinsky%E2%80%99s-rite-spring-modernism-ballet-and-riots?delta=0,"Stravinsky’s Rite of Spring: Modernism, Ballet, and Riots",ART & DESIGN,Introductory,Identify and describe forms and techniques used in 20th-century orchestral music Understand approaches to ballet choreography in the 20th century Appreciate cultural context and performance circumstances of Stravinsky’s The Rite of Spring,"Igor Stravinsky’s The Rite of Spring premiered in Paris in 1913, sparking a riot and screaming so loud that the dancers could not hear the orchestra, and the choreographer had to shout numbers from backstage to keep the dancers on beat. The Rite of Spring continues to challenge listeners. According to Stravinsky, The Rite of Spring was intended to portray “the surge of spring, the magnificent upsurge of nature reborn.” As you will see, Stravinsky’s description is almost frighteningly apt! Harvard’s Thomas Forrest Kelly (Morton B. Knafel Professor of Music) guides learners through The Rite of Spring, highlighting not only the contributions of Stravinsky, the composer, but also those of his collaborators. Professor Kelly takes learners through the ballet’s development, rehearsals, and finally, premiere performance, and he explores just how and why The Rite of Spring challenged (and to a certain extent, continues to challenge) its listeners. You will learn about the ballet’s innovative choreography, the basics of 20th-century orchestral form and technique, and the circumstances of this ballet’s first performance and subsequent history. Learners in this course need not have any prior musical experience.",stravinsky rite spring modernism ballet riots,art design,introductory,igor stravinsky rite spring premiered paris sparking riot screaming loud dancers could hear orchestra choreographer shout numbers backstage keep dancers beat rite spring continues challenge listeners according stravinsky rite spring intended portray surge spring magnificent upsurge nature reborn see stravinsky description almost frighteningly apt harvard thomas forrest kelly morton b knafel professor music guides learners rite spring highlighting contributions stravinsky composer collaborators professor kelly takes learners ballet development rehearsals finally premiere performance explores rite spring challenged certain extent continues challenge listeners learn ballet innovative choreography basics century orchestral form technique circumstances ballet first performance subsequent history learners course need prior musical experience
64,https://online-learning.harvard.edu/course/predictionx-omens-oracles-prophecies?delta=0,"PredictionX: Omens, Oracles & Prophecies",HUMANITIES,Introductory,A variety of methods from across cultures and history for divining the future A common framework that describes human attempts to predict the future,"Humans have always sought to know their own future, be it the destiny of an empire or an individual's fate. Across cultures and history, we find people trying to find their place in the Universe by attempting to gaze into the future. Join us for this one-week, immersive learning experience as we explore “pre-scientific” prediction systems ranging from ancient Chinese bone burning to the Oracle of Delphi to modern astrology and tarot, with practitioners and Harvard faculty leading the journey. We will examine the details of over a dozen prediction systems as well as theoretical frameworks connecting them. This module is a part of PredictionX, which examines our efforts to predict the future over all of recorded history. PredictionX courses will cover topics from omens and oracles in ancient civilizations, which this course discusses, to the evolution of the general approach to science most take today as well as modern computer simulations and the role they play in predicting our futures today.",predictionx omens oracles prophecies,humanities,introductory,humans always sought know future destiny empire individual fate across cultures history find people trying find place universe attempting gaze future join us week immersive learning experience explore pre scientific prediction systems ranging ancient chinese bone burning oracle delphi modern astrology tarot practitioners harvard faculty leading journey examine details dozen prediction systems well theoretical frameworks connecting module part predictionx examines efforts predict future recorded history predictionx courses cover topics omens oracles ancient civilizations course discusses evolution general approach science today well modern computer simulations role play predicting futures today
